{
  "version": "1.0",
  "bridge_id": "cve_2025_55156_pyload_receiver_container_string",
  "language": "python",
  "project": "cve-2025-55156-pyload",
  "gap_types": ["receiver", "container", "string_builder"],
  "scope": {
    "package": "pyload",
    "function": "FileDatabaseMethods.update_link_info"
  },
  "evidence": [
    {
      "kind": "source_to_container",
      "location": {
        "file": "poc/poc_cve_2025_55156_pyload.py",
        "line": 17,
        "expr": "data = [(\"name\", 1, 2, url)]"
      },
      "note": "The source URL is stored in tuple index 3 inside a list."
    },
    {
      "kind": "container_to_string",
      "location": {
        "file": "src/pyload/core/database/file_database.py",
        "line": 270,
        "expr": "statuses = \"','\".join(x[3] for x in data)"
      },
      "note": "The SQL string uses the URL element extracted through a generator."
    },
    {
      "kind": "string_to_sink",
      "location": {
        "file": "src/pyload/core/database/file_database.py",
        "line": 271,
        "expr": "self.c.execute(f\"SELECT id FROM links WHERE url IN ('{statuses}')\")"
      },
      "note": "The tainted join result is interpolated into an SQL f-string."
    }
  ],
  "graph_facts": {
    "type_facts": [
      {
        "id": "pyload_db_file_database_methods",
        "variable": "db",
        "scope": "poc_cve_2025_55156_driver",
        "type": "pyload.core.database.file_database.FileDatabaseMethods",
        "reason": "The PoC imports FileDatabaseMethods and annotates db with that type."
      }
    ],
    "call_edges": [
      {
        "id": "pyload_driver_to_update_link_info",
        "from": {
          "file": "poc/poc_cve_2025_55156_pyload.py",
          "line": 18,
          "function": "cve_2025_55156_driver",
          "expr": "db.update_link_info(data)"
        },
        "to": {
          "file": "src/pyload/core/database/file_database.py",
          "line": 261,
          "function": "FileDatabaseMethods.update_link_info"
        },
        "reason": "Receiver type fact resolves db.update_link_info to FileDatabaseMethods.update_link_info."
      }
    ]
  },
  "flow_facts": {
    "container_transfers": [
      {
        "id": "pyload_url_to_tuple_index",
        "scope": "cve_2025_55156_driver",
        "from": {
          "expr": "url"
        },
        "to": {
          "expr": "data[*][3]"
        },
        "location": {
          "file": "poc/poc_cve_2025_55156_pyload.py",
          "line": 17
        },
        "reason": "The tainted URL is stored as the fourth tuple element."
      },
      {
        "id": "pyload_tuple_index_to_generator",
        "scope": "FileDatabaseMethods.update_link_info",
        "from": {
          "expr": "data[*][3]"
        },
        "to": {
          "expr": "generator.element"
        },
        "location": {
          "file": "src/pyload/core/database/file_database.py",
          "line": 270
        },
        "reason": "The generator expression extracts x[3] from each tuple in data."
      }
    ],
    "string_transfers": [
      {
        "id": "pyload_generator_to_join",
        "scope": "FileDatabaseMethods.update_link_info",
        "from": {
          "expr": "generator.element"
        },
        "to": {
          "expr": "statuses"
        },
        "location": {
          "file": "src/pyload/core/database/file_database.py",
          "line": 270
        },
        "reason": "str.join returns a string containing generator elements."
      },
      {
        "id": "pyload_statuses_to_sql_fstring",
        "scope": "FileDatabaseMethods.update_link_info",
        "from": {
          "expr": "statuses"
        },
        "to": {
          "expr": "self.c.execute.arg0"
        },
        "location": {
          "file": "src/pyload/core/database/file_database.py",
          "line": 271
        },
        "reason": "The f-string passed to execute contains statuses."
      }
    ]
  },
  "validation": {
    "expected_trace_suffix": [
      "poc_cve_2025_55156_pyload.py:18 db.update_link_info(data)",
      "file_database.py:270 statuses = join(x[3] for x in data)",
      "file_database.py:271 self.c.execute(f\"...\")"
    ],
    "expected_sink": {
      "file": "src/pyload/core/database/file_database.py",
      "line": 271,
      "function": "FileDatabaseMethods.update_link_info",
      "expr": "self.c.execute(...)"
    }
  }
}
