{
  "version": "1.0",
  "bridge_id": "cve_2024_23334_aiohttp_static_follow_symlink_escape",
  "language": "python",
  "project": "cve-2024-23334-aiohttp",
  "gap_types": ["receiver", "string_builder"],
  "scope": {
    "package": "app",
    "function": "trigger_static_read"
  },
  "evidence": [
    {
      "kind": "source_to_receiver",
      "location": {
        "file": "app.py",
        "line": 22,
        "expr": "request_path = get_user_path()"
      },
      "note": "The attacker-controlled request path is materialized in the wrapper before entering StaticResource."
    },
    {
      "kind": "receiver_dispatch",
      "location": {
        "file": "app.py",
        "line": 24,
        "expr": "resource.resolve(request_path)"
      },
      "note": "The StaticResource receiver forwards the tainted path into the static route resolver."
    },
    {
      "kind": "path_decode",
      "location": {
        "file": "aiohttp/web_urldispatcher.py",
        "line": 12,
        "expr": "decoded_path = urllib.parse.unquote(raw_path)"
      },
      "note": "The raw URL path is decoded before prefix stripping."
    },
    {
      "kind": "prefix_strip",
      "location": {
        "file": "aiohttp/web_urldispatcher.py",
        "line": 15,
        "expr": "relative_url = decoded_path[len(self._prefix) :].lstrip(\"/\")"
      },
      "note": "The decoded request path is converted into a relative path under the static prefix."
    },
    {
      "kind": "follow_symlink_escape",
      "location": {
        "file": "aiohttp/web_urldispatcher.py",
        "line": 21,
        "expr": "return filepath.resolve()"
      },
      "note": "When follow_symlinks=True, the resolved path is returned without the directory containment check."
    },
    {
      "kind": "sink",
      "location": {
        "file": "aiohttp/web_urldispatcher.py",
        "line": 32,
        "expr": "open(filepath, \"rb\")"
      },
      "note": "The escaped static file path reaches the file read sink."
    }
  ],
  "graph_facts": {
    "call_edges": [
      {
        "id": "aiohttp_app_to_static_resolve",
        "from": {
          "file": "app.py",
          "line": 24,
          "function": "trigger_static_read",
          "expr": "resource.resolve(request_path)"
        },
        "to": {
          "file": "aiohttp/web_urldispatcher.py",
          "line": 26,
          "function": "resolve"
        },
        "reason": "The wrapper forwards the attacker-controlled request path to StaticResource.resolve."
      },
      {
        "id": "aiohttp_resolve_to_match",
        "from": {
          "file": "aiohttp/web_urldispatcher.py",
          "line": 27,
          "function": "resolve",
          "expr": "self._match(raw_path)"
        },
        "to": {
          "file": "aiohttp/web_urldispatcher.py",
          "line": 11,
          "function": "_match"
        },
        "reason": "The resolver delegates path decoding and prefix stripping to _match."
      },
      {
        "id": "aiohttp_resolve_to_resolve_path",
        "from": {
          "file": "aiohttp/web_urldispatcher.py",
          "line": 28,
          "function": "resolve",
          "expr": "self._resolve_path(relative_url)"
        },
        "to": {
          "file": "aiohttp/web_urldispatcher.py",
          "line": 18,
          "function": "_resolve_path"
        },
        "reason": "The resolver converts the matched relative URL into a filesystem path."
      },
      {
        "id": "aiohttp_resolve_to_handle",
        "from": {
          "file": "aiohttp/web_urldispatcher.py",
          "line": 29,
          "function": "resolve",
          "expr": "self._handle(filepath)"
        },
        "to": {
          "file": "aiohttp/web_urldispatcher.py",
          "line": 31,
          "function": "_handle"
        },
        "reason": "The resolved path is passed to the file response handler."
      }
    ]
  },
  "flow_facts": {
    "taint_transfers": [
      {
        "id": "aiohttp_source_to_request_path",
        "scope": "trigger_static_read",
        "from": {
          "expr": "request_path"
        },
        "to": {
          "expr": "request_path"
        },
        "location": {
          "file": "app.py",
          "line": 22
        },
        "reason": "trigger_static_read stores the user-controlled path before resolving the static resource."
      },
      {
        "id": "aiohttp_request_path_to_resolve_arg",
        "scope": "trigger_static_read",
        "from": {
          "expr": "request_path"
        },
        "to": {
          "expr": "StaticResource.resolve.arg0"
        },
        "location": {
          "file": "app.py",
          "line": 24
        },
        "reason": "The tainted request path is passed as the first argument to StaticResource.resolve."
      },
      {
        "id": "aiohttp_resolve_arg_to_raw_path",
        "scope": "resolve",
        "from": {
          "expr": "StaticResource.resolve.arg0"
        },
        "to": {
          "expr": "raw_path"
        },
        "location": {
          "file": "aiohttp/web_urldispatcher.py",
          "line": 26
        },
        "reason": "The resolve method receives the tainted path as raw_path."
      },
      {
        "id": "aiohttp_raw_path_to_decoded_path",
        "scope": "_match",
        "from": {
          "expr": "raw_path"
        },
        "to": {
          "expr": "decoded_path"
        },
        "location": {
          "file": "aiohttp/web_urldispatcher.py",
          "line": 12
        },
        "reason": "urllib.parse.unquote preserves attacker control while decoding the URL path."
      },
      {
        "id": "aiohttp_decoded_path_to_relative_url",
        "scope": "_match",
        "from": {
          "expr": "decoded_path"
        },
        "to": {
          "expr": "relative_url"
        },
        "location": {
          "file": "aiohttp/web_urldispatcher.py",
          "line": 15
        },
        "reason": "Static prefix stripping derives the filesystem-relative URL from the decoded request path."
      },
      {
        "id": "aiohttp_relative_url_to_filepath",
        "scope": "_resolve_path",
        "from": {
          "expr": "relative_url"
        },
        "to": {
          "expr": "filepath"
        },
        "location": {
          "file": "aiohttp/web_urldispatcher.py",
          "line": 19
        },
        "reason": "The relative URL is joined with the configured static directory."
      },
      {
        "id": "aiohttp_filepath_to_open",
        "scope": "_handle",
        "from": {
          "expr": "filepath"
        },
        "to": {
          "expr": "open.arg0"
        },
        "location": {
          "file": "aiohttp/web_urldispatcher.py",
          "line": 32
        },
        "reason": "The resolved filepath is used directly in open(filepath, 'rb')."
      }
    ]
  },
  "validation": {
    "expected_trace_suffix": [
      "app.py:22 request_path = get_user_path()",
      "app.py:24 resource.resolve(request_path)",
      "aiohttp/web_urldispatcher.py:12 decoded_path = urllib.parse.unquote(raw_path)",
      "aiohttp/web_urldispatcher.py:15 relative_url = decoded_path[len(self._prefix) :].lstrip(\"/\")",
      "aiohttp/web_urldispatcher.py:19 filepath = self._directory / relative_url",
      "aiohttp/web_urldispatcher.py:32 open(filepath, \"rb\")"
    ],
    "expected_sink": {
      "file": "aiohttp/web_urldispatcher.py",
      "line": 32,
      "function": "_handle",
      "expr": "open(filepath, \"rb\")"
    }
  }
}
